id,message,name
eum,Ut animi quis qui ut.,excepturi
ut,Minima aliquam et ipsa eum.,libero
iure,Maxime consectetur pariatur sapiente nesciunt.,ullam
ex,Facilis veniam vero eaque perferendis.,officiis
et,Esse repellendus cum animi dolorum facere dicta dolor quis.,cupiditate
dolorem,Sed necessitatibus eos minima ipsa nihil.,voluptas
vel,Neque hic est dolor quod et tenetur.,delectus
non,Iure inventore libero nam quia nesciunt optio dolorem.,facere
quibusdam,Voluptatem assumenda illum dolores impedit et et neque.,quia
quia,Officia sit et animi.,cum
praesentium,Itaque est ratione molestiae alias commodi.,sed
qui,Quia esse officia iure ut explicabo est omnis.,iusto
tenetur,Cum inventore fugiat voluptatem molestiae dolorum.,voluptatem
rerum,Est ullam veniam iure quae quia unde velit.,magnam
nemo,Similique omnis sint nobis et.,ut
at,Alias beatae qui et officia praesentium aut.,suscipit
possimus,In temporibus voluptatum occaecati ad animi consequatur eligendi atque.,esse
molestiae,Laudantium porro et quo praesentium sed aut quia.,est
voluptates,Molestias ratione et magnam voluptas nulla placeat.,eos
nisi,Itaque et dolorem vel sint voluptatem omnis.,aut
quae,Quia nesciunt fugit perferendis ducimus qui beatae doloremque.,blanditiis
doloremque,Eaque modi quam est ut rem deserunt commodi.,temporibus
totam,Natus consequatur voluptatem asperiores voluptatem autem.,nihil
vero,Cumque adipisci eos voluptatum aliquam excepturi ut perferendis corrupti.,at
architecto,Perferendis et sint necessitatibus aut et.,id
sit,Suscipit qui deleniti blanditiis vel incidunt.,doloribus
pariatur,Laudantium quia impedit non eum eum quas suscipit.,et
occaecati,Autem exercitationem qui illo rerum et odit.,aspernatur
omnis,Sequi ut qui minus.,vel
itaque,Molestiae qui maiores sit et illum possimus repellendus.,quidem
sequi,Non dolorem ut quam velit.,natus
nobis,Enim labore nemo aut non.,necessitatibus
aliquid,Ut sed saepe possimus sunt temporibus.,minima
maiores,Quidem rem natus et aut culpa in.,amet
accusamus,Minus cumque cupiditate sit perspiciatis.,vitae
maxime,Dicta voluptas nostrum perspiciatis fugit et corporis eum.,neque
ducimus,Aliquid quia corrupti officiis quo tempora architecto enim.,optio
libero,Error adipisci impedit ipsa.,ea
optio,Et officia dolor sunt omnis.,voluptatibus
atque,Dolore omnis repellendus ut sit aut qui.,ipsam
magnam,Veniam blanditiis quis dolor maiores sed.,sint
error,Quod ut illo possimus quia sunt id inventore.,earum
minus,Molestias est autem ut id et consequuntur.,repudiandae
velit,Alias nulla voluptatem est repellendus voluptas sed.,tenetur
harum,Quas autem sequi inventore aut quia.,dolor
voluptatem,Earum sed ut voluptates velit et vitae.,rem
eos,Ut ut ex repudiandae numquam.,provident
odio,Et aliquam temporibus est sit libero sed.,enim
aliquam,Eos quis minus assumenda voluptatem.,consequuntur
dolorum,Quia molestias quod qui voluptatibus.,nostrum
commodi,Voluptate occaecati rerum excepturi.,nulla
illum,Illo similique qui aliquam sit qui et.,impedit
enim,Architecto quae aut ullam et facilis quidem aut.,accusamus
ipsum,Ea quae in aut excepturi ab.,occaecati
eveniet,Minima accusantium qui enim eveniet.,perferendis
aut,Labore aperiam cum non nam nulla.,quod
doloribus,Enim laboriosam ad culpa autem quo.,aperiam
est,Omnis amet et occaecati reiciendis.,possimus
quas,Omnis dolorum iste ipsa molestiae ut autem magni.,quas
consectetur,Labore laudantium aut sit ipsam dolor aut.,omnis
veritatis,Ad sed eum repellendus enim laboriosam id.,molestiae
facere,Ipsa dolorum non nam dolorum.,quam
quisquam,Dolores ipsa dolor voluptates ex sed.,animi
tempora,Quod officia voluptates ea dolore.,consequatur
laborum,Dolorem et quo aut totam et est optio.,cumque
dolores,Sint qui omnis natus delectus et maxime ut.,eaque
debitis,Nihil voluptate recusandae qui reprehenderit modi aut aut et.,iure
rem,Dolorem aliquid architecto in vero.,quae
ipsam,Adipisci molestiae rerum laborum nobis.,ducimus
assumenda,Vel ut voluptates impedit dolore.,illum
deserunt,Perspiciatis aspernatur placeat ut aliquid.,modi
ipsa,Rerum tenetur praesentium ut perferendis nihil molestias occaecati.,fugit
consequuntur,Quo sunt dolor aut est aspernatur.,deleniti
soluta,Culpa provident ut aut quasi.,non
placeat,Hic eius enim sint et molestias.,porro
ab,Vel occaecati molestiae error esse quam qui.,unde
minima,Omnis quas ad qui odio expedita enim.,repellendus
eius,Quis qui velit accusantium delectus voluptatum.,qui
dolor,Qui tempore nam dolores voluptate animi velit accusamus.,nam
a,Sapiente commodi eveniet sint sunt.,laudantium
beatae,Et aut velit quo quisquam.,minus
neque,Magni adipisci ea pariatur explicabo enim dolorum maxime.,quis
alias,In cumque fuga rerum rerum animi.,eveniet
fugit,Repudiandae nobis ut rerum dolorem enim error eum.,quo
voluptatum,Voluptas qui in eum deserunt iste qui dignissimos aut.,asperiores
consequatur,Ducimus molestiae ab quisquam.,fugiat
cupiditate,Assumenda nihil harum consequuntur quo.,nisi
id,Soluta aliquam illum sit vero.,debitis
similique,Laborum maxime aperiam eaque laudantium quaerat.,perspiciatis
officia,Maxime fuga consectetur dolor earum repudiandae blanditiis.,sit
cumque,Quaerat voluptate omnis vel dolore voluptatem aut debitis libero.,dignissimos
temporibus,Et atque sequi expedita voluptatum non.,saepe
illo,Rerum vero aspernatur numquam possimus sunt sint dicta.,sequi
ea,Dolore consequatur deleniti qui voluptate occaecati et.,voluptate
impedit,Sapiente aut qui officia dolorem ea.,exercitationem
amet,Fugit perferendis accusantium eos quis illum similique laboriosam.,velit
quis,Quia ullam nam aut vel.,corrupti
fuga,Voluptates quo enim dolorem aspernatur placeat.,soluta
earum,Et esse commodi qui accusantium incidunt nihil.,odit
quam,Ea qui dolor accusamus dolor consequatur.,deserunt
eum,Tempore et consequatur iure ut eum sed.,commodi
ut,Quis omnis vero non accusamus nihil corporis.,nisi
iure,Possimus enim aperiam nemo eaque omnis.,ex
ex,Explicabo vel aliquam est ea.,vel
et,Rerum expedita omnis debitis.,facere
dolorem,Dignissimos pariatur exercitationem non officia saepe.,consequatur
vel,Omnis et repellendus aliquam.,nobis
non,Aut unde tempora rerum qui corrupti est voluptate quis.,debitis
quibusdam,Et voluptate consequatur aut optio quam.,iste
quia,Ullam ut ratione qui nihil recusandae nisi.,rem
praesentium,Vitae voluptas neque autem omnis quam quia non voluptas.,tempore
qui,Est non sapiente sunt tempora saepe quis.,harum
tenetur,Sed est fugiat architecto voluptatem.,qui
rerum,Veritatis quibusdam magnam quod aut minima ut qui.,aliquam
nemo,Quod deleniti quia quia odio quia non.,aperiam
at,Ut facere explicabo consequatur est modi adipisci.,numquam
possimus,Voluptas soluta ut est soluta magni.,corporis
molestiae,Ut dolor beatae quidem qui quo.,facilis
voluptates,Voluptatem ut voluptatem tempora enim voluptate aut officiis.,quae
nisi,Ipsam veritatis odit minima delectus.,provident
quae,Eligendi officiis eos debitis necessitatibus vitae quis.,accusantium
doloremque,Qui ut in fugiat sit mollitia et pariatur aut.,blanditiis
totam,Maiores amet rem voluptas voluptates.,explicabo
vero,Quia molestiae voluptas omnis quis neque commodi.,ipsam
architecto,Sint distinctio minus non dolor eligendi.,cumque
sit,Voluptatem atque sed consequuntur.,eum
pariatur,Maxime magnam quam cupiditate qui ut ut.,quo
occaecati,Temporibus aperiam ea eveniet ut.,ea
omnis,Velit quos sed voluptas facere quod nulla cum molestias.,saepe
itaque,Enim ut quia exercitationem natus.,rerum
sequi,Accusantium quis et ea voluptas.,error
nobis,Aliquam voluptatibus ipsam fugit eaque tenetur sed sint.,aliquid
aliquid,Explicabo ut doloremque ab delectus rerum optio.,voluptate
maiores,Et dolorum itaque aut sed et nemo error.,aut
accusamus,Sit sint ut architecto natus placeat.,natus
maxime,Nesciunt mollitia voluptatem assumenda similique.,possimus
ducimus,Velit consequatur illo non sequi aut distinctio suscipit consectetur.,ducimus
libero,Dolores facilis nulla quia animi minus vel et facilis.,deleniti
optio,Sunt et et porro incidunt quaerat maxime velit.,in
atque,Odio minima accusamus omnis et architecto.,et
magnam,Sint ea ipsam natus nisi eveniet voluptas tempora eveniet.,sunt
error,Deserunt sit quae deleniti dolor.,ut
minus,Odio eaque debitis non tempora.,enim
velit,Totam consectetur consequatur est facilis odio ea.,fuga
harum,Possimus impedit iure explicabo facilis ut sit ut velit.,minus
voluptatem,Eos inventore culpa libero pariatur ea.,dolorem
eos,Laborum tenetur optio quia est.,iusto
odio,Ea et asperiores hic est consequuntur.,voluptas
aliquam,Et praesentium aspernatur distinctio laborum voluptatem ut est.,animi
dolorum,Molestiae et cupiditate libero iusto earum.,architecto
commodi,At sequi eum cupiditate aperiam consequatur velit.,pariatur
illum,Et qui totam qui hic nulla aliquam adipisci.,ad
enim,Neque dolor illum beatae libero explicabo.,minima
ipsum,Dolore deleniti quo laborum laboriosam impedit eum est.,omnis
eveniet,Possimus quia quasi perferendis molestiae rerum dicta.,est
aut,Molestias et tempora non vel enim maiores consequatur eaque.,aspernatur
doloribus,Optio alias dolores dolores voluptatem.,quaerat
est,Reprehenderit autem sit iure accusantium.,illum
quas,Corporis qui ullam dicta qui officia repudiandae.,necessitatibus
consectetur,Sapiente dolores nam doloremque vitae sint nemo officia consequatur.,distinctio
veritatis,Voluptas dolorum nesciunt fugiat quam pariatur doloremque temporibus libero.,non
facere,Necessitatibus quam nulla et similique repudiandae.,quia
quisquam,Est facere quo officia hic.,laboriosam
tempora,Vel autem perspiciatis nemo numquam non natus.,quibusdam
laborum,Vero tenetur vitae non quas at harum sed.,eveniet
dolores,Est vero ut cum vero.,placeat
debitis,Placeat repudiandae corrupti quis quis quas dolorum.,totam
rem,Omnis voluptate vel non id et.,doloribus
ipsam,Maxime voluptas sequi possimus sunt.,maxime
assumenda,Fuga ad vel aut.,assumenda
deserunt,Autem eaque dicta voluptate voluptas rem possimus.,dolor
ipsa,Praesentium cumque quod distinctio totam est.,cupiditate
consequuntur,Ex eaque et aut ipsum dignissimos quia omnis.,repudiandae
soluta,Voluptate exercitationem reiciendis alias aut.,sint
placeat,Natus perspiciatis eos id ipsam corrupti.,sit
ab,Necessitatibus enim temporibus unde ea iste.,perspiciatis
minima,Natus voluptas inventore ipsam laborum omnis.,quisquam
eius,Nulla accusamus sequi maxime suscipit non id.,voluptatibus
dolor,Aut consectetur quisquam doloremque ut et autem.,esse
a,Sunt dolore dignissimos nihil qui.,voluptatem
beatae,Qui perferendis molestiae et dolor sint facere.,ullam
neque,Et dolor dicta aliquid.,molestiae
alias,Alias quidem incidunt debitis aut at nulla accusamus.,autem
fugit,Beatae expedita et aliquid facere.,dolores
voluptatum,Consequuntur repellendus ut sed eum quasi voluptates deleniti.,dignissimos
consequatur,Hic autem est et.,recusandae
cupiditate,Deleniti qui occaecati voluptatibus a.,ab
id,Praesentium aut quos laborum est.,temporibus
similique,Recusandae asperiores eos soluta et.,odit
officia,Deserunt est et dolor.,adipisci
cumque,Incidunt excepturi perferendis doloremque facere hic sint.,incidunt
temporibus,Qui omnis facere temporibus excepturi ex non sit.,at
illo,Possimus quos fuga error et.,occaecati
ea,Illum eaque illo dicta quae modi sapiente.,veritatis
impedit,Facere iste qui sapiente.,fugit
amet,Doloremque sunt quia velit praesentium.,eaque
quis,Consequatur velit distinctio quidem.,inventore
fuga,Consequuntur accusantium non neque quis voluptatibus culpa.,reiciendis
earum,Voluptas dolore ipsam quisquam molestias nihil in.,eos
quam,Accusamus odio deserunt occaecati voluptates maiores sapiente.,nihil
